tconst,primaryTitle,startYear
tt10735778,Lethal Kittens or How We Came to Love Our Shovels During a Limited Anti-Terrorist Operation with Temporary Elements of a State of War,2020
tt14552300,The Inventory Will Be Drawn Up at 11 a.m. In the Presence of the Poet's Wife,2021
tt13904268,Gekijo-ban Porisu × Senshi rabupatorina! ~ Kaito kara no chosen! Rabu de papatto taiho seyo!~,2021
tt15211076,Adolescence Changes in the Coronavirus Environment. How does a teenager react to a claustrophobic pandemic?,2021
tt13223776,Dracula Nazi Hunter: How I Learned to Love Christopher Lee and Drink Atomic Bombs,2021
tt2106692,The Freedom of the Heart - La Liberté du Coeur - The Whole Story,\N
tt2188356,Dreams Surpass the Surging Waves - The Man Who Lived His Destiny: Suminokura Ryôi,\N
tt12031212,Time Warp: The Greatest Cult Films of All-Time- Vol. 2 Horror and Sci-Fi,2020
tt12825680,All the Streets Are Silent: The Convergence of Hip Hop and Skateboarding (1987-1997),2021
tt13041482,Yáng guang xià de shào nián zhi wo de wú sè shì jiè,2020
tt13075922,There Are Not Thirty-six Ways of Showing a Man Getting on a Horse,2020
tt13997358,Fate/Grand Order The Movie Divine Realm Of The Round Table: Camelot Paladin; Agateram,2021
tt13054188,"Hataraku Saibo!! Saikyo no Teki, Futatabi. Karada no Naka wa Cho Osawagi!",2020
tt13194708,Verplant - How Two Guys Try to Cycle from Germany to Vietnam,2021
tt13876280,The Case Is Solved. I Know Everyone Who Tried to Kill Me,2020
tt14088760,20 Years Gone: The Joel Plaskett Emergency Revisits Down at the Khyber,2021
tt14210128,Det krokiga och det raka - en film om arkitekten Carl Nyrén,2021
tt14551164,Can You Bring It: Bill T. Jones and D-Man in the Waters,2020
tt15337666,Thomas & Friends: All Engines Go - Race for the Sodor Cup,2021
tt8459190,"An Officer and His Holiness, the Dalai Lama's Secret Escape Into Exile",\N
tt11188154,WeWork: Or the Making and Breaking of a $47 Billion Unicorn,2021
tt11202184,"Cuerdas del Espacio, Un recorrido por la obra de Horacio Lavandera",\N
tt11422728,"Summer of Soul (...Or, When the Revolution Could Not Be Televised)",2021
tt11915184,He Helped Me: A Fan Film from the Book of Saw,2021
tt12511276,From Fat Lolli to Six Pack Lolli: The Ultimate Transformation Story,2020
tt12752842,Jail Cell to Stem Cell: The Next Con for the Ex-Con,2020
tt3654340,Man in the Field: The Life and Art of Jim Denevan,2020
tt6434210,The Works and Days (of Tayoko Shiojiri in the Shiotani Basin),2020
tt6744988,Street Survivors: The True Story of the Lynyrd Skynyrd Plane Crash,2020
tt7579140,Breaking Their Silence: Women on the Frontline of the Poaching War,\N
tt9573468,"Events Transpiring Before, During, and After a High School Basketball Game",2020
tt0203086,Home-Coming in Granddaughter: The Cultural Complex of a Headman's Concubine,\N
tt11078000,I Am Lion: Journey Into the Mind of a Lion,\N
tt11564588,El hombre más peligroso de Europa. Otto Skorzeny en España,2020
tt11654024,Exhibition on Screen: Lucian Freud - A Self Portrait 2020,2020
tt11698280,Pretending I'm a Superman: The Tony Hawk Video Game Story,2020
tt11837558,I Propose We Never See Each Other Again After Tonight,2020
tt11865154,Art Comes from the Beak the Way It Has Grown,2020
tt12260790,Sith Wars: Episode I - The Return of the Sith,2021
tt12564514,Preparations to Be Together for an Unknown Period of Time,2020
tt12775424,Once Upon a Time in Tollywood Vol. 1: Flop Director,2020
tt12953178,Pros and Con Artists: The True Cost of Covid 19,2021
tt13328824,The Blind Man Who Did Not Want to See Titanic,2021
tt13424422,Sword Art Online: Progressive - Aria of a Starless Night,2021
tt13642590,Crayon Shin-chan: Shrouded in Mystery! The Flowers of Tenkazu Academy,2021
tt13867020,"The Grocer's Son, the Mayor, the Village and the World",2020
tt13875460,A Palace for Putin. The Story of the Biggest Bribe,2021
tt13922382,Intrecci etici - La rivoluzione della moda sostenibile in Italia,2021
tt13927614,Nūhū Yãg Mū Yõg Hãm: This Land Is Our Land!,2020
tt13938338,Woodlands Dark and Days Bewitched: A History of Folk Horror,2021
tt14018370,"When I Grow Up, I Want to Be a Pornstar",2021
tt14035154,What Do We See When We Look at the Sky?,2021
tt14063960,Mick Fleetwood & Friends Celebrate the Music of Peter Green,2021
tt14182828,SanDance! A Journey to the Heart of San Dance Culture,2020
tt14270802,A Nau dos Loucos - Mergulho e Decolagem de Pazucus,2021
tt14685168,Eiga ai no genzai: Part 1 - Kabe no mukode,2020
tt14727298,Kamen Rider Saber + Kikai Sentai Zenkaiger: Super Hero Senki,2021
tt14824600,The Lord of the Rings: The War of the Rohirrim,\N
tt14882302,Demon Slayer: Kimetsu no Yaiba - The Hashira Meeting Arc,2020
tt15173772,"What I lived, What I live, What I will live",2021
tt15392020,The 26th Street Garage: The FBI's Untold Story of 9/11,2021
tt4579756,The Legacy of Gaston Leroux: The Man Behind the Mask,\N
tt9850386,The Bee Gees: How Can You Mend a Broken Heart,2020
tt0062336,The Tango of the Widower and Its Distorting Mirror,2020
tt10038660,"Our Lady of San Juan, Four Centuries of Miracles",2021
tt10039354,JerryMaya's Detective Agency: The Secret of the Train Robber,2020
tt10075650,Indiana Jones and the Sanctuary of the Black Order,2021
tt11300452,The Peppercorns and the Secret of the Deep Sea,2020
tt11615038,After Truth: Disinformation and the Cost of Fake News,2020
tt11778272,Crock of Gold: A Few Rounds with Shane MacGowan,2020
tt11809034,Rurouni Kenshin: Final Chapter Part I - The Final,2021
tt11913330,"America, We Salute the Military with Preview of Beauties",\N
tt11991748,Rurouni Kenshin: Final Chapter Part II - The Beginning,2021
tt11994750,Made You Look: A True Story About Fake Art,2020
tt12491134,Deep Web Stalker: Don't Let Them Enter Your House,\N
tt12545324,"Fly Bird, Fly - The Hungarian Dance House Story",2020
tt13091122,Witness to 9/11: In the Shadows of Ground Zero,2020
tt13321042,"Driving While Black: Race, Space and Mobility in America",2020
tt13564336,Raquel Van Haver - The Women of My Land,2020
tt13570052,Nocturna: Side A - The Great Old Man's Night,2021
tt13622108,"Civil War (or, Who Do We Think We Are)",2021
tt13892710,A Fandemic: 50 Fans Celebrate 50 Years of Cinema,2021
tt14146688,Me contro te - Il mistero della scuola incantata,2021
tt14147078,Gekijouban Bang Dream! Episode of Roselia: Song I Am.,2021
tt14336786,Axel and the True Story of an Imaginary Illness,2020
tt14376940,Kamen Rider Zero-One Others: Kamen Rider Vulcan & Valkyrie,2021
tt14504496,I'm Sorry If I Took a Toll on You,2021
tt14521412,Puella Magi Madoka Magica: Turning the Tide of Walpurgis,\N
tt14786196,Karen the Cannibal: The B-Horror Movie Drinking Game Sequel,\N
tt14888874,Demon Slayer: Kimetsu no Yaiba - Mt. Natagumo Arc,2020
tt15041860,Letters from a Whistler Fan to a Conrad Fan,2020
tt15064554,The Day I Found a Girl in the Trash,2021
tt15094392,Happier Than Ever: A Love Letter to Los Angeles,2021
tt15101050,A Fake Novel About the Life of Arthur Rimbaud,2021
tt15313684,Mass of the Ages: Discover the Traditional Latin Mass,2021
tt15447296,The Assembly - Interviews from the Middle of Everything,2020
tt1817232,Phineas and Ferb the Movie: Candace Against the Universe,2020
tt1843918,Electric Light - elektrisches Licht in einer kleinen Stadt,2022
tt2456492,Window Boy Would Also Like to Have a Submarine,2020
tt4174800,Guardians of Being: How Dogs Can Change the World,\N
tt4601194,To Give or Not to Give: Reparations for Slavery,2023
tt6539750,Happy Happy Joy Joy: The Ren & Stimpy Story,2020
tt6668212,A Life of Speed: The Juan Manuel Fangio Story,2020
tt7939428,10 Things We Should Do Before We Break Up,2020
tt8014920,There Must Be Some Kind of Way Outta Here,\N
tt9059374,Outlawed: A Punk Rock Uprising in the Basque Country,2021
tt9354842,To All the Boys: P.S. I Still Love You,2020
tt9784708,Rise of the Teenage Mutant Ninja Turtles: The Movie,2022
tt10068916,Made in Abyss: Dawn of the Deep Soul,2020
tt10266862,Five Nights at Freddy's: Demons of the Past,2020
tt10294634,Wildfire: The Legend of the Cherokee Ghost Horse,2021
tt10355058,Secret Agent Dingledorf and His Trusty Dog Splat,2021
tt10479726,Mags and Julie Go on a Road Trip.,2020
tt10513698,For Madmen Only: The Stories of Del Close,2020
tt10845704,Mang Kepweng: The Mystery of the Black Scarf,2020
tt10945232,Men on the Verge of a Nervous Breakdown,2021
tt10975966,The Blind of the Ghost Cave: Angel's Eyes,2021
tt11219254,I Fell in Love Like a Flower Bouquet,2021
tt11245776,Skin: A History of Nudity in the Movies,2020
tt11306746,Knutsen & Ludvigsen 2 - Det store dyret,2020
tt11378264,Mucho Mucho Amor: The Legend of Walter Mercado,2020
tt11536684,Ek Sainik - The Tale of a warrior,2020
tt11617146,De club van Sinterklaas & het grote Pietenfeest,2020
tt11723904,The Sit-In: Harry Belafonte hosts the Tonight Show,2020
tt11736718,The house at the end of the forest,2020
tt11840954,My Blood & Bones in a Flowing Galaxy,2020
tt11864074,"In einem Land, das es nicht mehr gibt",\N
tt11898858,"Rules of the Assembly Line, at High Speed",2020
tt12041084,Kill Chain: The Cyber War on America's Elections,2020
tt12153366,"In good company, at Boromo's Grandes Personnes place",2020
tt12228290,Classic of Mountains and Seas - Ingenious Garlic,2020
tt12244776,A Drunk Scorpion Will Sting Itself to Death,2020
tt12443930,"The Things We Say, the Things We Do",2020
tt12444576,The Death of Cinema and My Father Too,2020
tt12458954,Auguste Escoffier - The Birth of Modern Gastronomy,2020
tt12642574,Knights of Sidonia: Love Woven in the Stars,2021
tt12798264,No Festival - A concert for no one,2020
tt12850062,Shinchan: Crash! Scribble Kingdom and Almost Four Heroes,2020
tt12944158,18 Year Old Seungha's Easy Piece of Cake,2020
tt12980392,Project Dreams: How to Build Mazinger Z's Hangar,2020
tt13011526,A Report on the Party and the Guests,2020
tt13120574,A Night at the Louvre: Leonardo da Vinci,2020
tt13162070,Jonas Kaufmann - A Global Star in Private,2020
tt13290168,High School Musical: The Musical: The Holiday Special,2020
tt13352168,Im Wahn - Trump und die Amerikanische Katastrophe,2020
tt13404868,The House of the Lost on the Cape,2021
tt13414418,The Hunger: The Story of the Irish Famine,2020
tt13665062,What If? Ehud Barak on War and Peace,2020
tt13681618,Kishiryu Sentai Ryusoulger Special Chapter: Memory of Soulmates,2021
tt13740078,Doraemon the Movie: Nobita's Little Star Wars 2021,2022
tt13913834,Bushkida - In Search of the Jewish-Spanish Language,2020
tt13923174,"Charlie, le journal qui ne voulait pas mourir",2021
tt13972260,Tant que j'ai du respir dans le corps,2020
tt14178564,Galaksija - racunar koji je odbio da umre!,2021
tt14198358,Italo Disco. The Sparkling Sound of the 80s,2021
tt14277974,Fairest of Them All: The Snow White Story,2022
tt14278036,Copper Skin and Iron Bones of Fang Shiyu,2021
tt14498690,Le mont Fuji vu d'un train en marche,2021
tt14687306,María Luisa Bemberg: The Echo of My Voice,2021
tt14756328,Alexey Balabanov. Find Your Own and Calm Down,2020
tt14779306,Mission: Joy - Finding Happiness in Troubled Times,2021
tt15141288,"If I Can't Have Love, I Want Power",2021
tt15164248,Why is it so hard to do good,2021
tt15296598,Go! Go! Cory Carson: Chrissy Takes the Wheel,2021
tt15409816,Eiga Sumikkogurashi: Aoi tsukiyo no mahô no ko,2021
tt15450302,The Endless Moment - The Painter Rolf Kuhlmann,2020
tt15541286,Hareket'ten Dergah'a Bir Yayinevi Hikayesi: Mekanlar ve Insanlar,2021
tt1740147,Daniel Dolphin and the Guardians of the Ocean,\N
tt2293916,Paranormal Ghost Hunters Case Files: Bam the Ghost,\N
tt2392361,Fragments from Olympus: The Vision of Nikola Tesla,\N
tt2741690,The Ocean at the End of the Lane,\N
tt3797512,Barb and Star Go to Vista Del Mar,2021
tt4009506,Once Upon a Time in New York City,\N
tt5451230,The Man Who Wanted to See It All,2021
tt5618690,Street Gang: How We Got to Sesame Street,2021
tt5715156,Five Kingdoms Trilogy - 1 - The Forest,\N
tt6203456,Countess of the Blood Red Vampire Death Lair!,\N
tt7069210,The Conjuring: The Devil Made Me Do It,2021
tt7524444,The House Next Door: Meet the Blacks 2,2021
tt7798990,Jason Rising: A Friday the 13th Fan Film,2021
tt8042004,Killer Raccoons! 2! Dark Christmas in the Dark!,2020
tt8092118,Fate/Stay Night: Heaven's Feel - III. Spring Song,2020
tt8580274,Eurovision Song Contest: The Story of Fire Saga,2020
tt9376612,Shang-Chi and the Legend of the Ten Rings,2021
tt9455436,The Year of the Death of Ricardo Reis,2020
tt9542372,The Man Who Thought He Was Salvador Dali,\N
tt10225420,The Universe in Which I Loved You,2020
tt10369344,The Fantastic Journey of Margot & Marguerite,2020
tt10370644,Helmut Newton: The Bad and the Beautiful,2020
tt1037226,The Adventures of Tintin: Red Rackham's Treasure,\N
tt10374360,Swimming Out Till the Sea Turns Blue,2020
tt10463030,Bhoot: Part One - The Haunted Ship,2020
tt10513474,In a Future April (The Young Pasolini),2020
tt10675392,Saezuru Tori Wa Habatakanai: The Clouds Gather,2020
tt10676012,To All the Boys: Always and Forever,2021
tt10696586,Some People Don't Revisit the Marriage Officiant,2021
tt10741620,The Artist - I Am Not Hamlet,\N
tt10803866,When Mom Is Away... With the Family,2020
tt10863950,"Kamen Rider Zi-O Next Time: Geiz, Majesty",2020
tt11078564,Catwalk: From Glada Hudik to New York,2020
tt11207240,Rock Dog 2: Rock Around the Park,2021
tt11357754,The Secret Life of a Celebrity Surrogate,2020
tt11376010,People Just Do Nothing: Big in Japan,2021
tt11394290,The Earth Is Blue as an Orange,2020
tt11416998,90 días para el 2 de julio,2021
tt11427318,"From Today, It's My Turn: The Movie",2020
tt11459366,Billie Eilish: The World's a Little Blurry,2021
tt11478014,Kishiryu Sentai Ryusoulger vs. Lupinranger vs. Patranger,2020
tt11505680,Death Rider in the House of Vampires,2021
tt11576374,Hello Again - A Wedding a Day,2020
tt11594766,The Secret Diary of an Exchange Student,2021
tt11696978,2020 Oscar Nominated Short Films: Live Action,2020
tt11710234,Hunter in the Blue Side of Manchester,2020
tt11784374,The Rachel and Dave Hollis Variety Show,\N
tt11790902,Schlingensief: A Voice That Shook the Silence,2020
tt11792512,Maya the Bee 3: The Golden Orb,2021
tt11802742,Sisters in the End of the World,2020
tt11819890,Pokémon the Movie: Secrets of the Jungle,2020
tt11835270,My Truth: The Rape of Two Coreys,2020
tt11910576,Jukebox: un rêve américain fait au Québec,2020
tt11989890,David Attenborough: A Life on Our Planet,2020
tt12063522,Easter Bunny Bloodbath 2: No More Tears,2020
tt12093878,LEGO DC: Shazam - Magic & Monsters,2020
tt12119582,Project 88: Back to the Future Too,2020
tt1223947,The Chronicles of Narnia: The Silver Chair,\N
tt12245782,Anche stanotte le mucche danzeranno sul tetto,2020
tt12286898,Girls und Panzer das Finale: Part III,2021
tt12297322,Extinction Rebellion: Désobéir avec amour et détermination,2020
tt1232759,The Fastest White Man in the World,\N
tt12396242,Greg Warren: Where the Field Corn Grows,2020
tt12553244,Sisters: The Summer We Found Our Superpowers,2020
tt12573146,On the Footsteps of Goethe in Sicily,2020
tt12575636,The New Corporation: The Unfortunately Necessary Sequel,2020
tt12611334,Mars: One Day on the Red Planet,2020
tt12675760,Meir Ariel - A Song of Pain,2020
tt12698710,Homeless: Sam & Sally - The Movie,2020
tt12856524,"The Good, the Bad, the Corny 2",2020
tt12944236,Homecoming - Marina Abramovic and Her Children,2020
tt13017204,The Fable: The Killer Who Doesn't Kill,2021
tt13081264,Story of Kale: When Someone's in Love,2020
tt13083598,Cage the Bear 3 - Stellar Intervex,2020
tt13100222,Words for an End of the World,2020
tt13100448,Stevie Nicks 24 Karat Gold the Concert,2020
tt13191856,In the Director's Chair Sits a Woman,2020
tt13199096,Il n'y a pas de faux métier,2020
tt13222128,The Mother Eagle (Le Sang du pélican),2020
tt13249534,The Story Beyond a Cup of Sake,2020
tt13282424,President Trump: Tweets from the White House,2020
tt13308738,Nick Hunter and the Cities of Cibola,\N
tt13315294,Far Out West: Inside California's Kerista Commune,2021
tt13329328,Up Close: The War in the 1950s,2020
tt13346812,May the Devil Take You: Chapter Three,\N
tt13348220,Les yeux ne font pas le regard,\N
tt13370504,Fuoriclasse: Dai banchi di scuola alle classifiche,2021
tt13381642,Ghumjeeling - A Meeting by the Railways,2021
tt13387422,"Vengeance Is Mine, All Others Pay Cash",2021
tt13389730,"Simone Veil, a Woman of the Century",2022
tt13400030,Don't Go Gentle: A Film About IDLES,2021
tt13445204,Lafortune en papier - The Paper Man,2020
tt13446406,Journey Around the Home in 60 Days,2020
tt13458600,Emicida: AmarElo - It's All for Yesterday,2020
tt13523262,Wired for Music- Inside the Wiener Symphoniker,2020
tt13561390,The Bells Are Ringing for Ahuva Ozeri,2020
tt13615386,"Ariana Grande: Excuse Me, I Love You",2020
tt13618016,The Male Gaze: The Boy Is Mine,2020
tt13623136,The Guardians of the Galaxy Holiday Special,2022
tt13627528,Everyone Wants to Be the Next Weismann,2020
tt13631040,Bombs Away - Die Bombardierung von Schaffhausen,2021
tt13651628,Belle: The Dragon and the Freckled Princess,2021
tt13667552,Kamen Rider Zero-One Others: Kamen Rider Metsuboujinrai,2021
tt13795454,On the line (Les expulsés de l'Amérique),2021
tt13863404,Outbreak: The Virus That Shook the World,2021
tt13884144,The Seven Deadly Sins: Cursed by Light,2021
tt13913536,Rita Hayworth la création d'un sex symbole,2020
tt13921426,There's Still Someone in the Woods (2021),2021
tt13972856,"Big Bond: Sex, Drugs and Sausage Rolls",2021
tt14034496,All the Light That We Can See,2020
tt14036438,Everything That Is Forgotten in an Instant,2020
tt14058484,Biggie: I Got a Story to Tell,2021
tt14076888,Hanau - Eine Nacht und ihre Folgen,2021
tt14173880,Persona: The Dark Truth Behind Personality Tests,2021
tt14236830,Vom Feuer bedroht - Waldbrand in Portugal,2020
tt14393202,Na mo Naki Sekai no End Roll,2021
tt14396208,The Heart and How to Use It,2021
tt14466064,Once Upon a Time in Hong Kong,2021
tt14539726,Breaking Boundaries: The Science of Our Planet,2021
tt14539744,"Bob Ross: Happy Accidents, Betrayal & Greed",2021
tt14669632,Heaven and Hell - The Centrepoint Story,2021
tt14721252,Coming Home: Par-delà Une nuit sans lune,2021
tt14760092,And They May Still Be Alive Today,2020
tt14792462,The River Way - Martial Art Training,2022
tt14866426,The Day We Lit Up the Sky,2021
tt14901058,Mortal Kombat Legends: Battle of the Realms,2021
tt14910946,Emicida: AmarElo - Live in São Paulo,2021
tt14928886,Gabriela - The German with the Bicycle,2021
tt14962518,Grethe Meyer: The Queen of Danish Design,2021
tt14967664,When the Olympus Collides with the Pampas,2021
tt14981646,The Call 3: End of the Line,2022
tt14999458,The Story of Film: A New Generation,2021
tt15014046,Searching for Sasquatch Chapter II: The Watchers,2021
tt15085784,Memories of a Murderer: The Nilsen Tapes,2021
tt15095938,Blood Brothers: Malcolm X & Muhammad Ali,2021
tt15096446,Hot Air Balloon on the Tall Mountain,2021
tt15215002,"Etcetera, in the World of Mario Dondero",2020
tt15220120,Mr. Suzuki: A Man in God's Country,2020
tt15228008,Hideaki Anno: The Final Challenge of Evangelion,2021
tt15298288,"Pan Mun Jom, You Have Never Seen",2021
tt15300338,In the Sky Where Seasons Pass By,2021
tt15355802,"Wagner, Bayreuth und der Rest der Welt",2021
tt15392066,Race Against Time: The CIA and 9/11,2021
tt15414160,Harald Naegeli - Der Sprayer von Zürich,2021
tt15439344,Boku ga Aishita Subete no Kimi e,2022
tt15450826,Kimi o Aishita Hitori no Boku e,2022
tt1590031,Frankenpimp's Revenge: The Romeo and Juliet Massacre,2020
tt2401814,The Loneliest Whale: The Search for 52,2021
tt2825808,Game On: Time to Pull the Strings,\N
tt3039056,Importance of Being Earnest: East Meets West,\N
tt3285894,The Maniac - Hell on my mind,\N
tt3785036,On the Job 2: The Missing 8,2021
tt4325984,Black Currency: The Fake Currency Truth Unfolds,\N
tt4446108,The Making of Memories for the Future,\N
tt4823776,The SpongeBob Movie: Sponge on the Run,2020
tt5446820,A Deadly Price for Her Pretty Face,2020
tt5843300,From Bedrooms to Billions: The Playstation Revolution,2020
tt5964482,The Fabulous Destiny of the Lost Egg,\N
tt6068756,It Hits You When You Know It,2020
tt7050946,American Traitor: The Trial of Axis Sally,2021
tt7086730,Devil's Night: Dawn of the Nain Rouge,2020
tt7246476,Journey to the Land of the Tarahumara,\N
tt7315826,Yes I Am: The Ric Weiland Story,2021
tt7600742,"Hallelujah: Leonard Cohen, a Journey, a Song",2021
tt7612146,Hotel Inferno 3: The Castle of Screams,2021
tt8006374,Baba Yaga: Terror of the Dark Forest,2020
tt8173726,World Order: Three Days and Three Nights,\N
tt8646060,Yuri!!! On Ice the Movie: Ice Adolesence,\N
tt8787350,Não Lamente a Morte de Francisco Caolho,\N
tt8801582,Little Crumb Race to the Gold Mine,2020
tt8959166,You Can Take It or Leave It,\N
tt9010738,Miss Fisher & the Crypt of Tears,2020
tt9016024,A Great Trip to a Small Country,2020
tt9050898,Murder to Mercy: The Cyntoia Brown Story,2020
tt9419884,Doctor Strange in the Multiverse of Madness,2022
tt9422682,"The Author, the Star, and the Keeper",2020
tt9578746,The Adventure of A.R.I.: My Robot Friend,2020
tt9595360,"Matando Cabos 2, La Máscara del Máscara",2021
tt9714478,"Harry Chapin: When in Doubt, Do Something",2020
tt9719864,"Calamity, a Childhood of Martha Jane Cannary",2020
tt9854706,Lost Objects: Three Encounters with the Gaze,\N
tt10016152,Mr Nelson on the North Side,2021
tt10101702,My Little Pony: A New Generation,2021
tt10148118,Behind the Line: Escape to Dunkirk,2020
tt10196356,The Disappearing World of Haruki Murakim,\N
tt10196518,The Man in the White Suit,\N
tt10198632,Florida College Comedy Tour on Fire,\N
tt10199056,Sweep The Rock: A Curling Odyssey,\N
tt10200522,Once Upon a Time in Indonesia,2020
tt10300396,Untitled Taika Waititi Star Wars Film,2025
tt10324122,Secret Society of Second Born Royals,2020
tt10341040,Around the World in 80 Days,2021
tt10345590,How I Became a Super Hero,2020
tt10353382,The Life of the Old Palace,\N
tt10360862,The Man Who Sold His Skin,2020
tt10370710,The Worst Person in the World,2021
tt10408944,Romance in the Outfield: Double Play,2020
tt10441878,A Mesma Parte de Um Homem,2021
tt10441958,How to Be a Good Wife,2020
tt10520822,Schwarzach 23 und das mörderische ich,2020
tt10532896,Mónika nem akar a földön járni,2020
tt10541126,Rockfield: The Studio on the Farm,2020
tt10588750,Doraemon the Movie: Nobita's New Dinosaur,2020
tt10595278,William Henry Pratt AKA Boris Karloff,\N
tt10603396,You Will Not Have My Hate,\N
tt10605812,The Girl Who Killed Her Parents,2021
tt10687506,The Electrical Life of Louis Wain,2021
tt10701532,The Case of the Dead Deadman,2020
tt1070874,The Trial of the Chicago 7,2020
tt10772654,"Have Fun, Vasya! Date in Bali",2021
tt10773114,One Day We'll Talk About Today,2020
tt10776270,May the Devil Take You Too,2020
tt10814876,7 Hours to Win Your Heart,2020
tt1086064,Bill & Ted Face the Music,2020
tt10917134,There Will Be No More Night,2020
tt10965850,"Bruno Reidal, Confession of a Murderer",2021
tt10975604,The Boy Who Killed My Parents,2021
tt10980650,Complete Portrait Wanted of Markéta Ledererová,2020
tt11080108,The Map of Tiny Perfect Things,2021
tt11173544,JFK Revisited: Through the Looking Glass,2021
tt11225360,"Stinky Dog, Happy Life in Paris!",2020
tt11231996,"A Nossa Terra, O Nosso Altar",2020
tt11240506,Nobody Sleeps in the Woods Tonight,2020
tt11261296,Bloodsuckers - A Marxist Vampire Comedy,2021
tt11281358,The Moment Trap: The Lennon Dream,2021
tt11391604,Once Upon a Time in Venezuela,2020
tt11454718,The Yin-Yang Master: Dream of Eternity,2020
tt11505692,Stay Out of the F**king Attic,2020
tt11536660,At the Back of the Screen,2020
tt11564218,The Best Is Yet to Come,2020
tt11568324,Dirty Clothes Are Washed at Home,2021
tt11575652,À la Chaleur des Années Froides,\N
tt11611416,The Last Temptation of the Belgians,2021
tt11629874,The Girl in the Feather Jacket,\N
tt11656800,Ottolenghi and the Cakes of Versailles,2020
tt11657594,Fred Jüssi. The Beauty of Being,2020
tt11657662,The Witcher: Nightmare of the Wolf,2021
tt11689090,The Nose or Conspiracy of Mavericks,2020
tt11704482,¿Earth in Trance or Transition? (2020),2020
tt11708140,Asylum: Twisted Horror and Fantasy Tales,2020
tt11726068,Cannon Arm and the Arcade Quest,2021
tt11754896,The Light from the Chocolate Factory,2020
tt11804758,Jimmy Carter: Rock & Roll President,2020
tt11905470,Screenplay of an Indian Love Story,2020
tt11905848,The State of Texas vs. Melissa,2020
tt11916302,Derek DelGaudio's In & Of Itself,2020
tt11916930,The Soul Which Dwells in Film,2020
tt11922434,Tina Turner: One of the Living,2020
tt11958790,The Prophet and the Space Aliens,2020
tt11981364,"Formentor, el mar de las palabras",2020
tt11991578,We Are Here We Are Close,2020
tt11991786,The Guide to the Perfect Family,2021
tt12044612,The Truth About La Dolce Vita,2020
tt12055134,Battle of Britain - Empty Skies,2020
tt12063914,Once Upon a Time in Karachi,2020
tt12077970,A Tale of Love and Desire,2021
tt12078932,Paternicillina: Story of a Forgotten Director,2020
tt12105596,Yes ka No ka Hanbun ka,2020
tt12108272,Close Encounters of the Fifth Kind,2020
tt12156990,Gone: The Lost Boys of Belfast,2020
tt12209212,Como el cielo después de llover,2020
tt1222318,Saturn and the End of Days,\N
tt12304596,Unfit: The Psychology of Donald Trump,2020
tt12313458,Un pays qui se tient sage,2020
tt12326604,"Erros Meus, Má Fortuna, Amor Ardente",2020
tt12331606,Zhang Sanfeng 2: Tai Chi Master,2020
tt12381206,Once Upon a Time in Calcutta,2021
tt12398350,The Swan Princess: A Royal Wedding,2020
tt12417292,The Nutcracker and the Mouse King,2022
tt12439210,7 Yards: The Chris Norton Story,2021
tt12445766,SIX60: Till the Lights Go Out,2020
tt12446112,Only the Devil Lives Without Hope,2020
tt12490780,The Brightest Roof in the Universe,2020
tt12528390,A Pandemic: Away from the Motherland,2020
tt12538822,All In: The Fight for Democracy,2020
tt12553046,The Loneliest Boy in the World,2022
tt12588094,Business Trip Massage: Excited Ladies 2,2020
