tconst,primaryTitle,startYear
tt13967368,The Great Yokai War: Guardians,2021
tt13977250,Livrés chez vous sans contact,2021
tt13989008,Fixed Barricade at Hamdalaye Crossing,2020
tt14013304,Jessie and the Elf Boy,2021
tt14018814,The Phantom of the Sauna,\N
tt14022026,Aa Bhi Ja O Piya,2021
tt14027580,Attack of the Murder Hornets,2021
tt14030510,I'm Fine (Thanks for Asking),2021
tt14030566,The Return: Life After ISIS,2021
tt14033416,Forest: I See You Everywhere,2021
tt14034966,Wheel of Fortune and Fantasy,2021
tt14035048,Herr Bachmann und seine Klasse,2021
tt14043948,A School in Cerro Hueso,2021
tt14079374,14 Peaks: Nothing Is Impossible,2021
tt14142352,Mashin Sentai Kiramager vs Ryusoulger,2021
tt14149544,Stories Not to Be Told,2021
tt14163772,Sagan om Karl-Bertil Jonssons julafton,2021
tt14167118,Ab Ye Galtiyan Na Ho,2021
tt14171710,Oscar Peterson: Black + White,2020
tt14223500,Manuale di storie dei cinema,2021
tt14233396,La Passió segons Pep Amores,2021
tt14252948,Who We Will Have Been,2021
tt14266320,Inside the Red Brick Wall,2020
tt14270360,Evanescence: Embracing the Bitter Truth,2021
tt14284900,Fu zi bian xing ji,2020
tt14314826,Fanny: The Right to Rock,2021
tt14318270,Louis Theroux: Shooting Joe Exotic,2021
tt14318430,Why Did You Kill Me?,2021
tt14331144,Jujutsu Kaisen 0: The Movie,2021
tt14356950,The Least We Can Do,2020
tt14360806,I Am Not a Player,2021
tt14412240,Momshies! Ang soul mo'y akin!,2021
tt14418138,True to the Game 3,2021
tt14418234,State of Siege: Temple Attack,2021
tt14440038,"Vortex, the Dawn of Sovereignty",2021
tt14444784,Samichay: In Search of Happiness,2020
tt14449464,Ishq: Not a Love Story,2021
tt14453030,Lie to Me the Truth,2021
tt14454740,Tari Yaad Ma Jindagi Javani,2021
tt14464962,Dark Web: Descent Into Hell,2021
tt14485794,Éoliennes: du rêve aux réalités,2021
tt14491408,How to Kill a Cloud,2021
tt14497264,I P*** on Your Corpse,2021
tt14500584,Beyond the Infinite Two Minutes,2021
tt14546082,Love Will Tear Us Apart,2021
tt14550078,The Whisper of the steps,2020
tt14550344,Until the Wheels Come Off,2021
tt14563506,The Boy with the Leica,2021
tt14577742,Not So Friendly Neighborhood Affair,2021
tt14636934,True and False Monkey King,2020
tt14641648,Psych 3: This Is Gus,2021
tt1465834,An American Werewolf in London,\N
tt14676110,Tell Them We Were Here,2021
tt14715098,Friendship Is Like a Cocoon,2021
tt14722156,Japan Sinks: 2020 Theatrical Edition,2020
tt14726550,Kímmapiiyipitssini: The Meaning of Empathy,2021
tt14759062,Gekijou Kidou Senshi Gundam SEED,\N
tt14776918,In Front of Your Face,2021
tt14786536,Los 4 hermanos: La Pelicula,\N
tt14791552,Shark Beach with Chris Hemsworth,2021
tt14812780,The Employer and the Employee,2021
tt14812784,A Night of Knowing Nothing,2021
tt14813966,Tyler Perry's A Madea Homecoming,2022
tt14852088,If God Were a Woman,2021
tt14859258,The Woman Who Cannot Feel,2021
tt14922060,The Ardour of the Shy,2021
tt14938280,All About Chiaki Mayumura (Provisional),2020
tt14961110,Night of the Animated Dead,2021
tt14962622,Whether the Weather Is Fine,2021
tt14966368,The Show Must Go On,2021
tt14967622,Golden Dawn: A Public Affair,2021
tt14992902,A Girl and a Guy,2021
tt15000314,White Snake 2: Green Snake,2021
tt15017758,Cuidado con lo que deseas,2021
tt15036416,Shiny_Flakes: The Teenage Drug Lord,2021
tt15062980,Bender: Gold of the Empire,2021
tt15068004,The Dust of Modern Life,2021
tt15073144,Dark Ditties from Down Under,2021
tt15085794,Untold: Deal with the Devil,2021
tt15085802,Untold: Malice at the Palace,2021
tt15089082,Rolê - Histórias dos Rolezinhos,2021
tt15091418,The Dawning of the Day,2021
tt15125812,Paka: The River of Blood,2021
tt15127976,Perfume Imaginary Museum Time Warp,2020
tt15135172,Zutto Dokushin de Iru Tsomori?,2021
tt15145742,Govenda Ali û Dayka Zin,2021
tt15170362,The Interview: Night of 26/11,2021
tt15174516,Cuatro Puntas. Música desde abajo,\N
tt15177182,Jutro czeka nas dlugi dzien,2021
tt15178384,En el nombre del Litio,2021
tt15204288,Confessions of an Invisible Girl,2021
tt15205238,It Is Not Over Yet,2021
tt15216504,The Women and the Murderer,2021
tt15218458,One and a Half Knot,2020
tt15223708,Herbert. Barbarian in the Garden,2021
tt15223788,Escape to the Silver Globe,2021
tt15250050,You vs. Wild: Out Cold,2021
tt15298350,Small Bird and Mr. Pig,2021
tt15299992,A Tale of Old Cities,2021
tt15319284,Schlesiens Schätze-Zwischen Riesengebirge und Oderlauf,2021
tt15348408,The River: Flow of Life,2021
tt15358484,One Day at A Time,2021
tt15371196,Let Me Hear It Barefoot,2021
tt15379842,El silencio de mis manos,\N
tt15387742,The Very Last Fishing Trip,2022
tt15395466,"Chiliheads, fous de piments forts",2021
tt15398694,Convergence: Courage in a Crisis,2021
tt15413986,Adolf Muschg - der Andere,2021
tt15420964,Ein Platz an der Sonne,\N
tt15424464,Animals United 2: The Chilldown,2024
tt15433116,This City Is a Battlefield,2022
tt15440862,Willi and the Wonder Toad,2021
tt15448824,Be Alive Just Like You,2020
tt15452372,Solo el mar nos separa,2021
tt15458844,Dogs Don't Bite Good People,2021
tt15458888,"Budmo, Hey. Dialogues About Dignity",2021
tt15465040,Camping Life (the ephemeral city),2021
tt15482612,The Apartment with Two Women,2021
tt15496244,When Flowers Are Not Silent,2021
tt15496646,The Road to the Law,2021
tt15500438,The Forbidden Tongue - Prologue,2021
tt15539332,How I Became a Partisan,2021
tt15539996,COVID-19: The Virus of Fear,2020
tt15546030,Mountains and Heaven in Between,2021
tt15614642,Good Girls Go to Heaven,2021
tt15619584,The First Girl I Loved,2021
tt15647338,A Custom of the Sea,2021
tt15658226,May God Be with You,2021
tt1985967,Tex Watt's Claudio Must Die!,\N
tt2005160,Tex Watt's Blood City Cops,\N
tt2023833,Juice!: Zombie Alley Vol. 1,\N
tt2042564,Give a Boy a Gun,\N
tt2061827,The Murders of Cane Hill,2021
tt2063724,Murder in a Small Town,\N
tt2075291,Cyborg Nemesis: The Dark Rift,\N
tt2076898,1 + 1 = 3,\N
tt2103180,Fast Flash to Bang Time,\N
tt2106466,In the Company of Lies,\N
tt2123969,In the Garden of Beasts,\N
tt2179271,Love and Something Like It,2022
tt2215473,La Aventura de Sandra Munt,\N
tt2357423,THE PREY: Legend of Karnoctus,2022
tt2375009,Fiesta Transnacional: 20 Años Después,\N
tt2397461,Clifford the Big Red Dog,2021
tt2455036,C.H.L.D. (Cat. Horse. Love. Death.),\N
tt2740554,A feu et a sang,\N
tt2765074,The Boy on the Bridge,\N
tt2850386,The Croods: A New Age,2020
tt3214356,Nasima - The Most Fearless,2021
tt3215824,Those Who Wish Me Dead,2021
tt3278540,A Nice Girl Like You,2020
tt3339320,Garrison 7: War Is Coming,\N
tt3513500,Chip 'n' Dale: Rescue Rangers,2022
tt3554046,Space Jam: A New Legacy,2021
tt3653144,D-War: Mysteries of the Dragon,\N
tt3661394,The One and Only Ivan,2020
tt3675680,The Kidnapping of Edgardo Mortara,\N
tt3792886,Das Capital Gulamon Ki Rajdhani,2020
tt3804810,Even Mice Belong in Heaven,2021
tt3826876,It's All About the Manners,\N
tt3955140,The Luigi0730 Finale: Super Squad,2020
tt3993886,All Day and a Night,2020
tt4015200,"Die Realität, die ich höre",\N
tt4027628,The Conspiracy of Dark Falls,\N
tt4180298,The Six Billion Dollar Man,\N
tt4269310,Chronicle of a Serial Killer,2020
tt4303414,Night of the Musical Dead,\N
tt4365590,The House on Fin Street,2021
tt4411584,The Secret: Dare to Dream,2020
tt4602522,As Guest of the King,\N
tt4680594,Vinski and the Invisibility Powder,2021
tt4696164,A Life Lost in Colours,2020
tt4712810,Now You See Me 3,\N
tt4911582,Zulus: The Crown of Thorns,\N
tt4911762,Paying a Visit to Fortuna,\N
tt4958742,Behind the Curtain of Night,\N
tt4966716,The Parts You Don't Hear,\N
tt5001824,Age of the Monkey King,\N
tt5045682,The Ballad of Billy McCrae,2021
tt5085434,Vielfalt: Just Go on Together,\N
tt5109280,Raya and the Last Dragon,2021
tt5113044,Minions: The Rise of Gru,2022
tt5138390,The Nailhouse: One says No,2020
tt5149620,Me and the Cult Leader,2020
tt5165118,"In Session, Do Not Disturb",2020
tt5195538,Untitled Hong Kong Action Thriller,\N
tt5276216,A Year Without a Summer,\N
tt5537002,Killers of the Flower Moon,\N
tt5598868,Here Are the Young Men,2020
tt5742712,Sunset on the River Styx,2020
tt5764650,Tales from the Dead Zone,\N
tt5792124,What the Night Can Do,2020
tt5850650,Tell It Like a Woman,2021
tt5853588,Don't Bet on the Brits,2021
tt5939328,My Dad Is a Sausage,2021
tt5963316,Jay Sebring....Cutting to the Truth,2020
tt6009232,"Tom, Dick and Harry 2",2021
tt6072992,The Great Indian Rope Trick,\N
tt6111574,The Woman in the Window,2021
tt6186024,Amanda and the Easter Bunny,2020
tt6349210,Heroes of the Golden Masks,2021
tt6462160,Eating Our Way to Extinction,2021
tt6469914,The Color of a Chameleon,2020
tt6472058,Two Lions Heading to Venice,2020
tt6482768,TATAMI the Least Hostile Place,\N
tt6532524,Two Women Over the Law,\N
tt6652510,Baikal: Amazing Adventures of Yuma,2021
tt6687720,Two Deaths of Henry Baker,2020
tt6779038,Children of Blood and Bone,\N
tt6820324,Timmy Failure: Mistakes Were Made,2020
tt6827878,Too Close to the Sun,\N
tt6874762,Coming Home in the Dark,2021
tt6932874,The Boss Baby: Family Business,2021
tt6955210,The Salt in Our Waters,2020
tt6976948,The Sticky Side of Baklava,2020
tt7014378,The Summit of the Gods,2021
tt7018574,Stuntwomen: The Untold Hollywood Story,2020
tt7097896,Venom: Let There Be Carnage,2021
tt7140274,Lennox Lewis: The Untold Story,2020
tt7157146,The Curse of Audrey Earnshaw,2020
tt7211258,Pepito Vs. Les messies sauvages,\N
tt7275646,The Battle of Savage Hill,\N
tt7308602,The Corruption of Divine Providence,2020
tt7333982,Basketball County: In the Water,2020
tt7395114,The Devil All the Time,2020
tt7411120,For the Love of Jessee,2020
tt7456312,The Last Thing He Wanted,2020
tt7504726,The Call of the Wild,2020
tt7509560,Too Soon: Comedy After 9/11,2021
tt7575746,El Jardín de las Luces,\N
tt7586238,Be Good or Be Gone,2020
tt7681998,We All Lie My Darling,2021
tt7697348,40: The Temptation of Christ,2020
tt7716120,And Tomorrow the Entire World,2020
tt7736496,Jingle Jangle: A Christmas Journey,2020
tt7737640,Breaking News in Yuba County,2021
tt7783886,House of The Rotting Flesh,\N
tt7802180,Curse of the Blind Dead,2020
tt7923118,Death of a Ladies' Man,2020
tt7939766,I'm Thinking of Ending Things,2020
tt7979580,The Mitchells vs the Machines,2021
tt7985704,Operation Fortune: Ruse de guerre,2022
tt7999072,Meeting the Beatles in India,2020
tt8004570,47 Days: The Mystery Unfolds,2020
tt8008948,Den of Thieves 2: Pantera,\N
tt8042080,Lost Treasure of Jesse James,2020
tt8110232,The Many Saints of Newark,2021
tt8137454,Paul Dood's Deadly Lunch Break,2021
tt8150814,There's Someone Inside Your House,2021
tt8187840,A Bend in the River,2020
tt8205028,The Story of My Wife,2021
tt8268302,I Work at the Cemetery,2021
tt8332922,A Quiet Place Part II,2020
tt8338494,The Curse of Willow Song,2020
tt8362228,The Stand at Paxton County,2020
tt8376234,Peter Rabbit 2: The Runaway,2021
tt8400856,The Grand Duke of Corsica,2021
tt8407968,The Principal of Monster Lake,2022
tt8451850,A Giant Without a Head!,2020
tt8560172,The Very Excellent Mr. Dundee,2020
tt8629728,"La Francisca, a Chilean Youth",2020
tt8630154,Drive Me to the End,2020
tt8740332,The Good Things Devils Do,2020
tt8741182,Dance Dreams: Hot Chocolate Nutcracker,2020
tt8756802,Superhuman: The Invisible Made Visible,2020
tt8820348,I Will Make You Mine,2020
tt8827032,Sudamerica: The Colors of Life,2020
tt8850222,Train to Busan Presents: Peninsula,2020
tt8857090,The Elephant in the Room,2020
tt8886670,The Father Who Moves Mountains,2021
tt8906722,The Killing of Kenneth Chamberlain,2020
tt8907348,Indestructible: No Place to Hide,2020
tt8907992,The Girl on the Train,2021
tt8944962,Collodion: The Process of Preservation,2020
tt9010360,The Legend of the Five,2020
tt9014248,Mutiny of the Worker Bees,2020
tt9056822,The Man in the Hat,2020
tt9065630,Let Me Have My Son,2022
tt9075038,Fear and Loathing in Aspen,2021
tt9083126,She Is One of Us,2020
tt9083198,Everything in Its Right Place,\N
tt9090232,The Ghosts of 33rd Street,2020
tt9115230,The Journey of Mr. Deshee,\N
tt9115530,The Eyes of Tammy Faye,2021
tt9134096,My Body Will Bury You,2021
tt9145510,Schweigend steht der Wald (AT),\N
tt9159882,The Pirates of Diego Garcia,\N
tt9169200,Slumber Party Slaughter Party 2,\N
tt9170516,The Shadow in My Eye,2021
tt9203832,Fireball: Visitors from Darker Worlds,2020
tt9220966,The Trouble with Being Born,2020
tt9253926,The Curse of Hobbes House,2020
tt9261052,The Five Rules of Success,2020
tt9269988,How to Deter a Robber,2020
tt9301556,All the Pretty Little Horses,2020
tt9308390,Margrete: Queen of the North,2021
tt9320140,The Man with the Answers,2021
tt9330648,Tu te souviendras de moi,2020
tt9340892,All My Friends Hate Me,2021
tt9378672,Brian Wilson: Long Promised Road,2021
tt9383986,The Man Who Drew God,2021
tt9390218,English ki taay taay fisss,2020
tt9414574,TKG: The Kids of Grove,2020
tt9440416,A Impossibilidade de Estar Só,2020
tt9449952,The House on the Cliff,2021
tt9467386,Life as It Should Be,2020
tt9507234,Digimon Adventure: Last Evolution Kizuna,2020
tt9564270,A Christmas Gift from Bob,2020
tt9580138,Mortal Kombat Legends: Scorpion's Revenge,2020
tt9612892,The Black Emperor of Broadway,2020
tt9613354,The Hunchback of Notre Dame,\N
tt9628568,The Cloud in Her Room,2020
tt9639676,Songs for While I'm Away,2020
tt9659926,A Barge on the Ocean,2020
tt9663764,Aquaman and the Lost Kingdom,2022
tt9665786,Un tour chez ma fille,2021
tt9665968,Small Country: An African Childhood,2020
tt9673190,The Lego Batman Movie 2,\N
tt9686708,The King of Staten Island,2020
tt9715670,Reuben Hood: Prince of Darts,\N
tt9726452,Nash the Slash Rises Again!,\N
tt9763402,The Misadventures of Mistress Maneater,2020
tt9763792,We Make Antiques! Kyoto Rendezvous,2020
tt9765226,1 Night in San Diego,2020
tt9784798,Judas and the Black Messiah,2021
tt9844522,Escape Room: Tournament of Champions,2021
tt9878054,Régis Campo: Strange Beautiful Music,2021
tt9881630,Nahuel and the Magic Book,2020
tt9881850,Dalia and the Red Book,\N
tt0228802,Mugen ryûkyû tsuru Henrî,2021
tt0427340,Masters of the Universe,\N
tt0893398,Brodie's Law: Project Jameson,\N
tt0984981,Escape from New York,\N
tt0993840,Army of the Dead,2021
tt10020940,Heroes of Destiny III,\N
tt10037796,To Comfort a Butterfly,\N
tt10039364,Mamma Moo Finds Home,2021
tt10043458,The Whisper of Silence,2021
tt10072662,A Bookshop in Paris,2021
tt10095582,The Tragedy of Macbeth,2021
tt10106394,Forest for the Trees,2021
tt10126136,Tribal Get Out Alive,2020
tt10132976,The Salt of Tears,2020
tt10141026,Big Trouble in Seattle,2021
tt10147580,Tre nøtter til Askepott,2021
tt10167422,Voices in the Wind,2020
tt10172366,Prince Volodymyr the Great,2020
tt10180470,Tera Yaar Hoon Main,\N
tt10193752,The Real Charlie Chaplin,2021
tt10196438,"Southern Ape, Northern Wolf",\N
tt10196452,Friends of the shade,\N
tt10198072,Don't Let Them In,2020
tt1020080,Too Far from Home,\N
tt10203744,Beast of Silk City,\N
tt10204056,Of Faith and Glory,\N
tt10205016,Not All Who Wander,2020
tt10206818,The Voice of Sin,2020
tt10215134,Nothing But the Sun,2020
tt10215434,Hearts on Fire: Crossfire,2021
tt10222712,Ten Pounds of Gold,\N
tt10233406,Les blagues de Toto,2020
tt10262380,Boys from County Hell,2020
tt10278750,Lend Me Your Light,\N
tt10293308,A Killer Next Door,2020
tt10300394,Star Wars: Rogue Squadron,2023
tt10302982,JL Family Ranch 2,2020
tt10303888,The Law of Destiny,2021
tt10304142,Untitled David O. Russell,2022
tt10308500,Butai Yu Yu Hakusho,2020
tt10309906,Shubh Mangal Zyada Saavdhan,2020
tt10310096,John Lewis: Good Trouble,2020
tt10326918,Crawl to Me Darling,2020
tt10329134,Your Name Engraved Herein,2020
tt10340596,Il capitano dei ghiacci,\N
tt10362566,The Exorcism of God,2021
tt10364478,Turn of the Screw,2020
tt10366574,Prayers for the Stolen,2021
tt10369866,Ten Minutes to Midnight,2020
tt10370818,Il colore della fatica,\N
tt10375272,Men at Work: Miami,2020
tt10375916,Night of the Sicario,2021
tt10388028,Enemies of the State,2020
tt10389078,Dimmi io chi sono,2020
tt10393074,Amy Tan: Unintended Memoir,2021
tt10393440,The Old Town Girls,2020
tt10396038,Neither Hero Nor Traitor,2020
tt10438500,Alone with Her Dreams,2020
tt10441806,The Way We Are,2020
tt10448662,Bender: The Final Hustle,\N
tt10482504,The Trip to Greece,2020
tt10514222,Ma Rainey's Black Bottom,2020
tt10514432,Mommy Is a Murderer,2020
tt10554196,Pungo: A Witch's Tale,2020
tt10564692,Wenn die Heidelerche singt,\N
tt10569922,Bunty Aur Babli 2,2021
tt10573946,There's Something About Mario,2021
tt10580094,My Name Is Raja,2020
tt10600398,We Can Be Heroes,2020
tt10601432,Confessions of a Producer,2020
tt10609050,"Leonie, actrice en spionne",2020
tt10612362,A Spark in Nothing,2021
tt10612922,One Night in Miami...,2020
tt10616760,Shadow of the Cat,2021
tt10627548,Christmas on the Square,2020
tt10648342,Thor: Love and Thunder,2022
tt10649008,I'm Not in Love,2021
tt10659766,The Christmas High Note,2020
tt10687740,Princess Lost in Time,2020
tt10691314,Are We Lost Forever,2020
tt10695464,The Source of Shadows,2020
tt10696784,The Harder They Fall,2021
tt10701074,Ponniyin Selvan: Part One,2022
tt10711918,Cry of the Birds,\N
tt10712928,Stars Fell on Alabama,2021
tt10722406,Come Play with Me,2021
tt10726144,"V chorniy, chorniy kimnati",2021
tt10727214,Pirates Down the Street,2020
tt10728764,Nobody Knows I'm Here,2020
tt10731264,Suraj Pe Mangal Bhari,2020
tt10738666,The Wanderlust of Apu,2021
tt10798660,Wish Upon a Unicorn,2020
tt10801042,Love Aaj Kal Porshu,2020
tt10808832,Let Them All Talk,2020
tt10813062,The Act of Reading,2021
tt10841088,Riverdance: The Animated Adventure,2021
tt10845876,The Shrew of Destiny,\N
tt10850034,Tomorrow Will Be Fine,2021
tt10852008,Balakot: the true story,2020
tt10852686,S.O.S. Survive or Sacrifice,2020
tt10857048,Our 30 Minute Sessions,2020
tt10862050,It Came from Below,2021
tt10863072,Witches of Amityville Academy,2020
tt10869088,"Carnies, Clowns and Cocaine",2020
tt10870008,16 Bars to Love,2021
tt10872600,Spider-Man: No Way Home,2021
tt10875678,Happy Hardy and Heer,2020
tt10893378,Merrily We Roll Along,\N
tt10895828,The Marathon of Desires,2020
tt10910306,Flight Over The Water,2020
tt10915060,The Crimes That Bind,2020
tt10916120,Ik Sandhu Hunda Si,2020
tt10926320,Dating & New York,2021
tt10928612,So She Doesn't Live,2021
tt10934006,Sihja - kapinaa ilmassa,2021
tt10935956,Kira & El Gin,2022
tt10941528,Under the Riccione Sun,2020
tt10944276,Death of a Telemarketer,2020
tt10944744,The Escape from Auschwitz,2020
tt10945158,A Change of Heart,2021
tt10951288,Blood on the Crown,2021
tt10953022,Tak nazyvaemaya lyubov. Krasnoe,2021
tt10962368,Things Heard & Seen,2021
tt10965308,Själö: Island of Souls,2020
tt10975730,Virgo and the Sparklings,2021
tt10984206,On the 3rd Day,2021
tt10993580,Not Quite Dead Yet,2020
tt11013434,Antoinette dans les Cévennes,2020
tt11018044,Ladies of the Wood,2021
tt11018424,If It Were Love,2020
tt11024272,The Babysitter: Killer Queen,2020
tt11032374,Demon Slayer: Mugen Train,2020
tt11050886,The Only Way Out,2021
tt11053478,The Last Fishing Trip,2020
tt11058214,Fires in the Dark,2020
tt11068166,All Hands on Deck,2020
tt11079552,A Game Called Relationship,2020
tt11080922,A Handful of Water,2020
tt11090178,Striding Into the Wind,2020
tt11096446,Murder in the Vineyard,2020
tt11123012,The Secret of Sinchanee,2021
tt11125620,The Addams Family 2,2021
tt11125636,"Yakari, a Spectacular Journey",2020
tt11142556,Learning to Love Again,2020
tt11151982,Goblin Slayer: Goblin's Crown,2020
tt11154906,Out of My League,2020
tt11161474,Pieces of a Woman,2020
tt11183868,Bad Habits Die Hard,2020
tt11187484,The Thief of Baghdad,2020
tt11188010,Nobody Has to Know,2021
tt11188206,15 Minutes of Shame,\N
tt11188560,A Taste of Hunger,2021
tt11197464,Bitter Taste of Ginger,2021
tt11220260,La Senda del Pastor,2021
tt11224748,Woman in the Woods,2020
tt11229646,Heart of a Lion,2020
tt11238932,My Heart Goes Boom!,2020
tt11248432,The Krays: New Blood,2023
tt11259310,"Nazinha, Pray for Us",2021
tt11278140,Fandango at the Wall,2020
tt11280556,The Madness Inside Me,2020
tt11280912,Maarjaara Oru Kalluvacha Nuna,2020
tt11300738,Who Am I Now?,2021
tt11304504,Catch the Fair One,2021
tt11306684,Back to the Wharf,2020
tt11310884,Historia de lo Oculto,2020
tt11316854,Gabriel's Inferno: Part One,2020
tt11318086,Cómo mueren las reinas,2021
tt11318348,Brahma Janen Gopon Kommoti,2020
tt11320192,The Evil Next Door,2020
tt11324626,The Last Christmas Party,2020
tt11343552,Anukunnadi Okkati Ayyindhi Okati,2020
tt11358166,Some Kind of Heaven,2020
tt11358398,The Man Standing Next,2020
tt11362842,When Time Got Louder,\N
tt11368998,25 Years of Innocence,2020
tt11373840,Saajan Bakery Since 1962,2021
tt11385336,Memories of My Father,2020
tt11388822,Romance on the Menu,2020
tt11389850,Sandra Gets a Job,2021
tt11390036,A Fall from Grace,2020
tt11390126,Barkers: Mind the Cats!,2020
tt11390180,Upon the Magic Roads,2021
tt11392114,"Bloody Nose, Empty Pockets",2020
tt11394180,Dick Johnson Is Dead,2020
tt11401900,Astounding Courage in Distress,2020
tt11423540,Hidden in the Spotlight,2020
tt11433696,Solo Brathuke So Better,2020
tt11436196,Sakkhee an Eye Witness,2020
tt11451708,Between Fire and Water,2020
tt11454890,Luv Ni Love Storys,2020
tt11455260,School of Magical Animals,2021
tt11457736,My Dad's Christmas Date,2020
tt11493046,City on the River,2020
tt11493106,All About My Sister,2020
tt11497232,The Kung Fu Master,2020
tt11506054,Uma Maheswara Ugra Roopasya,2020
tt11510804,Turn of the Cheek,2020
tt11525022,Dance of the 41,2020
tt11537282,Vi er her nå,2020
tt11558628,Member Rameshan 9am Ward,\N
tt11563592,Brightheart: Firefly Action Brigade,2020
tt11565130,The Last Movie Painter,2020
tt11568236,The House in Between,2020
tt11576938,Il Ladro di Cardellini,2020
tt11577280,Bajo un sol poderoso,2021
tt11580914,Yaadhum Oore Yaavarum Kelir,2021
tt11581046,Oru Pakka Nadan Premam,2020
tt11595702,"Kiss Him, Not Me",2020
tt11604772,For the Time Being,2020
tt11611106,All That I Am,2020
tt11615764,Sabne bana di jodi,2020
tt11621896,Detection of Di Renjie,2020
tt11625100,The Metamorphosis of Birds,2020
tt11634288,Battle of Little Bighorn,2020
tt11640106,The Perimeter of Kamsé,2020
tt11644116,Live or Let Die,2020
tt11646342,Escape from Area 51,2021
tt11656220,Midnight in the Switchgrass,2021
tt11671006,The Man from Toronto,2022
tt11671040,Riverdance 25th Anniversary Show,2020
tt11674528,A Moment of Happiness,2020
tt11675884,The Journey Weekend Night,2020
tt11681282,The Mad Women's Ball,2021
tt11681310,Should the Wind Drop,2020
tt11689278,The Astronaut of God,2020
tt11697148,Mishima: The Last Debate,2020
tt11697690,The Woman Who Ran,2020
tt11697844,There Is No Evil,2020
tt11709788,Kehta Hai Yeh Dil,2020
tt11713606,Fantasma vuelve al pueblo,2021
tt11718726,The Industry Did It,2020
tt11721566,"Mo' Money, Mo' Problems",2020
tt11728358,We Don't Deserve Dogs,2020
tt11730570,The Presumption of Guilt,2020
tt11736776,Mon cirque à moi,2020
tt11737772,Chal Mera Putt 2,2020
tt11739498,30 Rojullo Preminchadam Ela?,2021
tt11742524,Nothing But the Blood,2020
tt11742798,Afterlife of the Party,2021
tt11747286,One in a Thousand,2020
tt11755650,When My Time Comes,2021
tt11755740,The Texas Chainsaw Massacre,2021
tt11758356,Notes from the Underworld,2020
tt11759906,Locos de Amor 3,2020
tt11764870,Tears of the Clown,2020
tt11771028,The House of Love,2020
tt11772420,A Storm Was Coming,2020
tt11772786,Between Dog and Wolf,2020
tt11773276,Krishna and His Leela,2020
tt11773588,Drowning in Holy Water,2020
tt11803662,Manja Satta Pacha Satta,2021
tt11809482,Sadika: The Multi-Dimensional Artist,2020
tt11826450,Lady of the Manor,2021
tt11828634,The Last Fortress: Hacibey,2020
tt11832046,PAW Patrol: The Movie,2021
tt11833648,The Sun of Gnosis,2020
tt11841066,The Forest Cartel Case,2020
tt11847556,El siglo de Galdós,2020
tt11856638,The Late Night Ride,2020
tt11859518,One Step from Me,2021
tt11865946,The Art of Return,2020
tt11867418,Looking for Magical DoReMi,2020
tt11874226,David Byrne's American Utopia,2020
tt11874886,Ostatni Ludzie Czarnobyla 3,2020
tt11886678,Listyev. A New Vzglyad,2020
tt11892034,V2. Escape from Hell,2021
tt11900404,Caught in the Net,2020
tt11904798,Miracle Fishing: Kidnapped Abroad,2020
tt11905872,Goddess of the Fireflies,2020
tt11907624,Courting Mom and Dad,2021
tt11916296,Echoes of the Invisible,2020
tt11917942,Wife of a Spy,2020
tt11924110,Enter the Girl Dragon,\N
tt11924226,Selfie Mummy Googl Daddy,2020
tt11924476,A Werewolf in England,2020
tt11928696,"Blue, Painful and Brittle",2020
tt11928960,Kamen Rider Zero-One: Real×Time,2020
tt11937670,El Father Plays Himself,2020
tt11946300,Deep Blue Sea 3,2020
tt11951334,Eureka: Eureka Seven Hi-Evolution,2021
tt11952776,Karnan Napoleon Bhagat Singh,2020
tt11991466,5 Adi 7 Angula,2020
tt12000616,To See El Aaiún,2020
tt12013758,Caught by a Wave,2021
tt12015590,Coming Soon Last Days,2020
tt12023982,The Science Fiction Makers,2020
tt12025556,All In: The Family,2020
tt12025884,I Want to Believe,2020
tt12029164,Death by 1000 Cuts,2020
tt12045028,Nympho: The Lust Story,2020
tt12059768,Gandhi Fer Aa Gea,2020
tt12069948,Um Dia Com Jerusa,2020
tt12071618,Ee Kathalo Paathralu Kalpitam,2021
tt12072168,No Place for Angels,2020
tt12077826,Death Inhabits at Night,2020
tt12084320,Main Mulayam Singh Yadav,2021
tt12089546,Safaibaaz - The Scavenger,2021
tt12128038,Out of the World,2020
tt12133722,Have a Good Trip,2020
tt12135398,What Makes Women Tick,2020
tt12139700,Jungle Beat: The Movie,2020
tt12147360,Fire on the Plain,2021
tt12149972,Become Who You Are,2020
tt12151818,Across the Furious Sea,2021
tt12156954,The Life We Know,2020
tt12159116,Rhapsodies of A Sexaholic,2020
tt12192190,One Night in Bangkok,2020
tt12207658,English Padha Na Balamua,2021
tt12215286,Dino Dana: The Movie,2020
tt12226872,The Scary of Sixty-First,2021
tt12280548,The Light Between Us,2020
tt12282600,This Lady Called Life,2020
tt12291978,The Super Animated Movie,\N
tt12294158,The Real Will Wood,2020
tt12311866,Children of the Corn,2020
tt12312912,Fire in the Mountains,2021
